Dealer ID,Dealer Name,Phone,Address,City,State,Custom Address,Dealer Iframe Map,Zip Code,About Dealer,Dealer Image,Radius,Rating,Review Count,Invnetory Link
D-24770139,Mobilease Auto Sales,N/A,3815 Dacoma Street,Houston,TX,"Houston, TX",N/A,77092,"Friendly sales associate, actually went and got the van from the Chevy dealership that was performing some service on the vehicle, so 
that I could come look at the van while I was in the area for other appointments.",https://static.cargurus.com/images/site/2017/11/29/12/32/mobilease_auto_sales-pic-5280559911735687120-200x200.jpeg,3 mi,5.0,3,https://www.cargurus.com/Cars/m-Mobilease-Auto-Sales-sp376662
D-24770140,GoAuto,N/A,1502 W 34th St,Houston,TX,"Houston, TX",N/A,77018,"I went to the address they gave me and when I 
got there there was no car dealership or car 
company in that place then I called the phone 
number again someone answered and said this 
address is wrong then he gave me the other 
address to go and I actually went to the new 
address but they were closed and after that I tried 
calling again and again he didn't answer the calls 
.   and today, July 6 someone call me from go 
auto and he was rude and not nice and he lie to 
me.  and there is a lot of details so what Iâm trying 
to say that this dealership is not professional And 
liar and rude and   Untrustworthy. + his foxy.",https://static.cargurus.com/images/site/2018/10/08/11/52/goauto-pic-5811619847297469802-200x200.jpeg,3 mi,4.3,6,https://www.cargurus.com/Cars/m-GoAuto-sp411151
D-24770141,Texas Bus Sales,N/A,1605 West 34th St.,Houston,TX,"Houston, TX",N/A,77206,No reviews available,No image,3 mi,N/A,N/A,https://www.cargurus.com/Cars/m-Texas-Bus-Sales-sp380287
D-24770142,Ella Blvd Motors,N/A,3401 Ella Blvd,Houston,TX,"Houston, TX",N/A,77018,They did respond right away with an email and all the info I needed.,https://static.cargurus.com/images/site/2020/08/21/12/22/ella_blvd_motors-pic-1011352813318949237-200x200.jpeg,3 mi,5.0,2,https://www.cargurus.com/Cars/m-Ella-Blvd-Motors-sp319726
D-24770143,Knapp Chevrolet,N/A,815 Houston Ave,Houston,TX,"Houston, TX",N/A,77007,Good,https://static.cargurus.com/images/site/2017/07/13/10/27/knapp_chevrolet__inc_-pic-8338474593457235737-1600x1200.png,3 mi,3.1,8,https://www.cargurus.com/Cars/m-Knapp-Chevrolet-sp53544
D-24770144,Auto Icon,N/A,423 E 29th St,Houston,TX,"Houston, TX",N/A,77008,No reviews available,https://static.cargurus.com/images/site/2016/06/06/19/25/auto_icon-pic-5345762944659680892-200x200.jpeg,3 mi,N/A,N/A,https://www.cargurus.com/Cars/m-Auto-Icon-sp345655
D-24770145,Momentum Volkswagen of Upper Kirby,N/A,2405 Richmond Ave,Houston,TX,"Houston, TX",N/A,77098,"Javier was amazing, smoothest and fastest car shopping experience. Highly recommend!",https://static.cargurus.com/images/site/2022/07/28/16/58/momentum_volkswagen_of_upper_kirby-pic-16187901033834331179-200x200.jpeg,3 mi,4.2,13,https://www.cargurus.com/Cars/m-Momentum-Volkswagen-of-Upper-Kirby-sp63105
D-24770146,Helfman Alfa Romeo,N/A,7720 Katy Freeway,Houston,TX,"Houston, TX",N/A,77024,No reviews available,https://static1.cargurus.com/gfx/dealersnearme/dealer_logo_placeholder.png,3 mi,N/A,N/A,https://www.cargurus.com/Cars/m-Helfman-Alfa-Romeo-sp302136
D-24770147,Helfman Dodge Chrysler Jeep Ram,N/A,7720 Katy Freeway,Houston,TX,"Houston, TX",N/A,77024,They responded promptly and answered my questions,https://static1.cargurus.com/gfx/dealersnearme/dealer_logo_placeholder.png,3 mi,5.0,6,https://www.cargurus.com/Cars/m-Helfman-Dodge-Chrysler-Jeep-Ram-sp284660
D-24770148,Helfman Maserati,N/A,"7720 Katy Fwy,  Houston TX 77024 United States",Houston,TX,"Houston, TX",N/A,77024,No reviews available,No image,3 mi,N/A,N/A,https://www.cargurus.com/Cars/m-Helfman-Maserati-sp447939
D-24770149,AMC Trucks,N/A,6519 Long Point Rd,Houston,TX,"Houston, TX",N/A,77055,No reviews available,https://static.cargurus.com/images/site/2024/06/26/11/22/amc_trucks-pic-10035273823076945744-200x200.jpeg,3 mi,N/A,N/A,https://www.cargurus.com/Cars/m-AMC-Trucks-sp454160
D-24770150,Auto-x autosales,N/A,803 N Loop Fwy,Houston,TX,"Houston, TX",N/A,77022,Very helpful and responsive. Was not aware of previous accident on vehicle. That is the only reason we couldn't make a deal.,https://static1.cargurus.com/gfx/dealersnearme/dealer_logo_placeholder.png,3 mi,4.3,3,https://www.cargurus.com/Cars/m-Auto-x-autosales-sp452215
D-24770151,Audi Central Houston,N/A,2120 Southwest Freeway,Houston,TX,"Houston, TX",N/A,77098,"Great great experience Andre , Christian , and their finance manager were amazing and helped me effortlessly to get me in a car. I would highly recommend taking them to buy your next car. Amazing service and great customer service !",https://static1.cargurus.com/gfx/dealersnearme/dealer_logo_placeholder.png,3 mi,5.0,3,https://www.cargurus.com/Cars/m-Audi-Central-Houston-sp342841
D-24770152,Porsche River Oaks,N/A,4007 Greenbriar Drive,Houston,TX,"Houston, TX",N/A,77098,Great experience and customer service 10/10 if I could rate it 10 stars,https://static.cargurus.com/images/site/2024/09/23/12/25/porsche_river_oaks-pic-1421487764043578845-200x200.jpeg,3 mi,5.0,7,https://www.cargurus.com/Cars/m-Porsche-River-Oaks-sp290490
D-24770153,River Oaks Chrysler Jeep Dodge Ram,N/A,4807 Kirby Drive,Houston,TX,"Houston, TX",N/A,77098,"The dealer quickly responded to my inquiry; however,  we were unable to agree on a price. This vehicle is way overpriced, and on top of that, as of tomorrow, it will be a yr. old.  Not good.",https://static.cargurus.com/images/site/2015/12/01/11/35/river_oaks_chrysler_jeep_dodge_ram-pic-6787208333669609613-200x200.jpeg,3 mi,4.4,7,https://www.cargurus.com/Cars/m-River-Oaks-Chrysler-Jeep-Dodge-Ram-sp63198
D-24770154,MidWest Auto Group,N/A,1025 N Loop Fwy,Houston,TX,"Houston, TX",N/A,77022,No reviews available,https://static1.cargurus.com/gfx/dealersnearme/dealer_logo_placeholder.png,3 mi,N/A,N/A,https://www.cargurus.com/Cars/m-MidWest-Auto-Group-sp455184
D-24770155,"Strait Motor Cars, Inc.",N/A,4125 Richmond Avenue,Houston,TX,"Houston, TX",N/A,77027,No reviews available,No image,3 mi,5.0,1,https://www.cargurus.com/Cars/m-Strait-Motor-Cars-Inc-sp287422
D-24770156,Auto Drive,N/A,1015 Antoine Dr,Houston,TX,"Houston, TX",N/A,77055,Just purchased a car here and had a very comfortable experience. They have a lot of high-end vehicles in great conditions. Sales person Juanita was very professional and made the experience positive. I will be back to purchase my next vehicle from them.,https://static.cargurus.com/images/site/2024/05/16/14/21/auto_drive-pic-16911997169164983584-200x200.jpeg,3 mi,5.0,3,https://www.cargurus.com/Cars/m-Auto-Drive-sp448563
D-24770157,Mercedes-Benz of Houston Greenway,N/A,3900 Southwest Freeway,Houston,TX,"Houston, TX",N/A,77027,I bought the car Mrs Perez & Mr Enrique wuz wonderful ! Great experience,https://static.cargurus.com/images/site/2017/08/07/13/13/mercedes-benz_of_greenway-pic-282425395839658129-1600x1200.jpeg,4 mi,4.6,29,https://www.cargurus.com/Cars/m-Mercedes-Benz-of-Houston-Greenway-sp278176
D-24770158,Advantage BMW Midtown,N/A,1305 Gray St,Houston,TX,"Houston, TX",N/A,77002,Great fast response to questions.,https://static.cargurus.com/images/site/2022/09/19/15/38/advantage_bmw_midtown-pic-6075023656131270586-200x200.jpeg,4 mi,4.2,39,https://www.cargurus.com/Cars/m-Advantage-BMW-Midtown-sp311059
D-24770159,Drive Max,N/A,3907 Irvington Blvd,Houston,TX,"Houston, TX",N/A,77009,Contacted promptly,https://static.cargurus.com/images/site/2021/11/18/15/43/drive_max-pic-10418249074105146902-200x200.jpeg,4 mi,4.8,8,https://www.cargurus.com/Cars/m-Drive-Max-sp347598
D-24770160,Amazon Auto Sales,N/A,4619 N Shepherd Dr,Houston,TX,"Houston, TX",N/A,77018,"The dealership contacted me promptly.  Ana is very pleasant and professional.  They seem to have to be able to work with everyone 
regardless of their credit challenges.  They were honest and straight shooters.  Will certainly be back.",https://static.cargurus.com/images/site/2016/01/27/12/23/amazon_auto_sales-pic-2918115089392385852-200x200.jpeg,4 mi,3.2,4,https://www.cargurus.com/Cars/m-Amazon-Auto-Sales-sp284659
D-24770161,Auto Alliance,N/A,1616 McGowen St.,Houston,TX,"Houston, TX",N/A,77004,They have gone overboard to help me on this vehicle,https://static1.cargurus.com/gfx/dealersnearme/dealer_logo_placeholder.png,4 mi,5.0,3,https://www.cargurus.com/Cars/m-Auto-Alliance-sp437826
D-24770162,Alsa Enterprise Motors,N/A,3055 Sage Rd,Houston,TX,"Houston, TX",N/A,77056,"Found three problems in the car before buying. AC, radio and   brakes. They fixed the first two and changed the pads for the front wheels only. We paid the amount in cash doing our best making sure the car has no issues as they said and carfax showed. Got the car from them and took it to a Toyota dealership. They found an engine oil leak which cost us $2600. Called them, they said we can't do anything for you. So, if you want to buy from them do yourself a favor and take the car to a mechanic. If they do not let you, go somewhere else because they do not own their dishonesty.",https://static.cargurus.com/images/site/2022/07/24/00/54/alsa_enterprise_motors-pic-15432572599325212906-200x200.jpeg,4 mi,4.3,7,https://www.cargurus.com/Cars/m-Alsa-Enterprise-Motors-sp402153
D-24770163,Auto Outlet,N/A,4301 Mangum Rd,Houston,TX,"Houston, TX",N/A,77092,I was called and responded,https://static.cargurus.com/images/site/2019/09/13/14/39/auto_outlet-pic-91095247770788093-200x200.jpeg,5 mi,4.8,10,https://www.cargurus.com/Cars/m-Auto-Outlet-sp408182
D-24770164,Westside Motors,N/A,8150 Long Point Rd,Houston,TX,"Houston, TX",N/A,77055,I have looked at two vehicles if memory serves specifically with Westside. Each and every time Dealership reached out to me to see if I had any further questions in regards to the vehicle that I was shopping for it. I found her interest and information always helpful and it was there to answer any questions that I may have.,https://static.cargurus.com/images/site/2019/10/02/12/43/westside_motors-pic-7426599545972888841-200x200.jpeg,5 mi,5.0,3,https://www.cargurus.com/Cars/m-Westside-Motors-sp376082
D-24770165,TX Auto Group,N/A,5803 Richmond Ave,Houston,TX,"Houston, TX",N/A,77057,Car was not ready to show.  Dead battery and was very dirty.  Never was able to start it up.  Looking at the overall condition of the car it's a $5000 car all day long.  Lots of balls asking $12000 for it.,https://static.cargurus.com/images/site/2022/06/06/16/10/tx_auto_group-pic-13871017061343817152-200x200.jpeg,5 mi,4.3,79,https://www.cargurus.com/Cars/m-TX-Auto-Group-sp377433
D-24770166,Houston Auto Broker,N/A,5613 Star Ln,Houston,TX,"Houston, TX",N/A,77057,The dealer was very quick and responsive when I inquired about a vehicle.,https://static.cargurus.com/images/site/2020/02/07/14/15/houston_auto_broker-pic-6835528226536903025-200x200.jpeg,5 mi,3.0,2,https://www.cargurus.com/Cars/m-Houston-Auto-Broker-sp410287
D-24770167,Fard Auto Group LLC,N/A,904 W Tidwell Rd B2,Houston,TX,"Houston, TX",N/A,77091,No reviews available,https://static.cargurus.com/images/site/2024/08/27/16/22/fard_auto_group_llc-pic-16681977244293151274-200x200.jpeg,5 mi,N/A,N/A,https://www.cargurus.com/Cars/m-Fard-Auto-Group-LLC-sp456553
D-24770168,XSell Motors,N/A,5628 Star Ln,Houston,TX,"Houston, TX",N/A,77057,No reviews available,No image,5 mi,1.0,1,https://www.cargurus.com/Cars/m-XSell-Motors-sp284677
D-24770169,Park Place Auto Sales,N/A,5829 Richmond Ave,Houston,TX,"Houston, TX",N/A,77057,Had a good experience,https://static.cargurus.com/images/site/2021/01/06/01/28/park_place_auto_sales-pic-4704002873961473803-200x200.jpeg,5 mi,4.5,2,https://www.cargurus.com/Cars/m-Park-Place-Auto-Sales-sp439958
D-24770170,SC Sales,N/A,5711 Star Ln,Houston,TX,"Houston, TX",N/A,77057,"Good has car, informative",https://static1.cargurus.com/gfx/dealersnearme/dealer_logo_placeholder.png,5 mi,4.0,1,https://www.cargurus.com/Cars/m-SC-Sales-sp288360
D-24770171,Team Autoplex,N/A,5714 Star Lane,Houston,TX,"Houston, TX",N/A,77057,"Best experience ever!!!! First time buying a car off a dealership and I couldn't ask for a better salesman. Very patient and understanding. He walk me through the process of buying the CRV and worked with my credit union since I was financing with TDECU. Overall, 10/10 and would highly recommend them!!!!",https://static.cargurus.com/images/site/2018/04/11/14/58/team_autoplex-pic-516247948254136546-200x200.jpeg,5 mi,5.0,4,https://www.cargurus.com/Cars/m-Team-Autoplex-sp238386
D-24770172,Hollywood Motors,N/A,5624 Southwest Fwy,Houston,TX,"Houston, TX",N/A,77057,No reviews available,No image,5 mi,N/A,N/A,https://www.cargurus.com/Cars/m-Hollywood-Motors-sp414115
D-24770173,K9 Motors,N/A,309 East Tidwell Road,Houston,TX,"Houston, TX",N/A,77022,"Good customer service,  was patient with me during traffic,  has extreme good manners...",https://static.cargurus.com/images/site/2022/03/01/10/25/k9_motors-pic-3073292702711235075-200x200.jpeg,5 mi,5.0,1,https://www.cargurus.com/Cars/m-K9-Motors-sp436459
D-24770174,S Auto Houston,N/A,5704 Southwest Fwy,Houston,TX,"Houston, TX",N/A,77057,No reviews available,No image,5 mi,N/A,N/A,https://www.cargurus.com/Cars/m-S-Auto-Houston-sp446887
D-24770175,Jaycee Imports LLC,N/A,5708 Southwest Fwy,Houston,TX,"Houston, TX",N/A,77057,Great dealer to do business with.,https://static1.cargurus.com/gfx/dealersnearme/dealer_logo_placeholder.png,5 mi,5.0,2,https://www.cargurus.com/Cars/m-Jaycee-Imports-LLC-sp457011
D-24770176,Houston Car Direct,N/A,5825 Schumacher Ln,Houston,TX,"Houston, TX",N/A,77057,Great job. They answered my questions.,https://static.cargurus.com/images/site/2023/07/18/22/09/houston_car_direct-pic-13316145985954383463-200x200.jpeg,5 mi,4.9,10,https://www.cargurus.com/Cars/m-Houston-Car-Direct-sp447945
D-24770177,Auto Vision LLC,N/A,"5804 Star Ln,  Suite A",Houston,TX,"Houston, TX",N/A,77057,My experience was great! So great I bought another BMW. I will definitely be a repeat customer!,https://static.cargurus.com/images/site/2019/04/02/13/06/auto_vision_llc-pic-2448900695767434240-200x200.jpeg,5 mi,5.0,2,https://www.cargurus.com/Cars/m-Auto-Vision-LLC-sp410589
D-24770178,Nxcess Motorcars,N/A,5726 Southwest Freeway,Houston,TX,"Houston, TX",N/A,77057,I did a deposit and they sold the car anyway after talking to me sign in the contract and then they sold the car to somebody else two days later without notifying me,https://static.cargurus.com/images/site/2015/07/23/17/52/nxcess_motorcars-pic-6456808874945779376-200x200.jpeg,5 mi,3.7,6,https://www.cargurus.com/Cars/m-Nxcess-Motorcars-sp284676
D-24770179,J&J Fleet LLC,N/A,1501 Bingle Rd,Houston,TX,"Houston, TX",N/A,77055,Great communication!,https://static1.cargurus.com/gfx/dealersnearme/dealer_logo_placeholder.png,5 mi,5.0,2,https://www.cargurus.com/Cars/m-J-J-Fleet-LLC-sp454625
D-24770180,Done Deal Auto Sales,N/A,5701 Southwest Freeway,Houston,TX,"Houston, TX",N/A,77057,"I live in San Antonio and you're in Houston. I like the car it was just priced higher than 
I wanted to spend for a 7 year old car. I guess, I'm just old school. I don't believe in 
the no hassle pricing. That just works for the dealer. I person I talked too was nice he 
did listen. I did give him a price I felt was a good deal. But, it's their car. They sell it for 
whatever they want too. I told them that someone will come along an buy it.",https://static1.cargurus.com/gfx/dealersnearme/dealer_logo_placeholder.png,5 mi,3.4,16,https://www.cargurus.com/Cars/m-Done-Deal-Auto-Sales-sp441602
D-24770181,AUTOTROPHIES,N/A,3361 Fountain View Dr,Houston,TX,"Houston, TX",N/A,77057,Great,https://static.cargurus.com/images/site/2022/10/25/13/20/autotrophies-pic-17704842037552753702-200x200.jpeg,5 mi,4.0,1,https://www.cargurus.com/Cars/m-AUTOTROPHIES-sp448762
D-24770182,"MetacarsTX, LLC",N/A,4833 Pinemont Dr,Houston,TX,"Houston, TX",N/A,77092,No reviews available,https://static.cargurus.com/images/site/2024/06/28/11/48/metacarstx__llc-pic-14043757482439579925-200x200.jpeg,5 mi,N/A,N/A,https://www.cargurus.com/Cars/m-MetacarsTX-LLC-sp455565
D-24770183,United Express Auto,N/A,5907 Star Lane,Houston,TX,"Houston, TX",N/A,77057,Exceptional service,https://static1.cargurus.com/gfx/dealersnearme/dealer_logo_placeholder.png,5 mi,5.0,1,https://www.cargurus.com/Cars/m-United-Express-Auto-sp401323
